{
  "slug": "data-reconciliation-mismatch",
  "title": "Data Reconciliation Mismatch Runbook",
  "description": "Identify and resolve data inconsistencies between Stripe subscriptions and local database",
  "tool": "operational",
  "key_type": ["recovery"],
  "severity_level": "p2",
  "version": "1.0.0",
  "runtime_dependency": "assisted",
  "required_access_level": "write",
  "produces_evidence": true,
  "compliance_relevance": ["SOC2", "GDPR"],
  "references_jupyter_keys": [
    "jupyter-stripe-subscription-reconciliation",
    "jupyter-data-drift-analysis"
  ],
  "references_node_keys": [
    "node-background-reconciliation"
  ],
  "related_runbooks": [
    "stripe-webhook-failure",
    "database-connection-failure"
  ],
  "outcome": "recovery",
  "maturity": "scale",
  "tags": ["data", "reconciliation", "stripe", "recovery"],
  "license_spdx": "MIT",
  "author": {
    "name": "KEYS Team"
  },
  "documentation": {
    "readme": "README.md",
    "checklist": "checklist.md",
    "changelog": "CHANGELOG.md"
  }
}
